<!DOCTYPE frameset SYSTEM "frameset.dtd">
<frameset>
	<predicate lemma="прекратиться">
	<note>NOTES: Added for LORELEI to support aligning RU and EN texts. Data from Skatje Myers.</note>
		<roleset id="прекратиться.01" name="cease">
			<aliases>
				<alias framenet="" pos="j" verbnet="">прекратившийся</alias>
				<alias framenet="" pos="v" verbnet="">прекращаться</alias>
				<alias framenet="" pos="j" verbnet="">прекращающийся</alias>
				<alias framenet="" pos="j" verbnet="">прекращавшийся</alias>
				<alias framenet="" pos="j" verbnet="">прекращать</alias>
				<alias framenet="" pos="j" verbnet="">прекращающий</alias>
				<alias framenet="" pos="j" verbnet="">прекращавший</alias>
				<alias framenet="" pos="j" verbnet="">прекращаемый</alias>
				<alias framenet="" pos="v" verbnet="">прекратить</alias>
				<alias framenet="" pos="j" verbnet="">прекративший</alias>
				<alias framenet="" pos="j" verbnet="">прекращённый</alias>
				<alias framenet="" pos="j" verbnet="">прекращенный</alias>
			</aliases>
			<note>Corresponds to FrameBank senses 1</note>
			<note>прекратиться.01 NOTES: Frame based on adjustment of English cease.01</note>
			<roles>
				<role descr="causer of ceasing, Agent" f="pag" n="0" />
				<role descr="Theme (action or object being stopped)" f="ppt" n="1" />
			</roles>
			<example name="arg1 only" src="" type="">
				<text>В субботу осадки прекратились , выглянуло солнце и движение в столице возобновилось .</text>
				<arg f="tmp" n="m">В субботу</arg>
				<arg f="" n="1">осадки</arg>
				<rel f="">прекратились</rel>
			</example>
			<example name="active imperfective" src="Л. Н. Толстой, «Война и мир», 1867—1869 г. (цитата из Национального корпуса русского языка, см. Список литературы)" type="">
				<text>Несмотря на свою рассеянность и добродушие , личность Пьера прекращала тотчас же всякие попытки на насмешку в его присутствии . </text>
				<arg f="adv" n="m">Несмотря на свою рассеянность и добродушие</arg>
				<arg f="" n="0">личность Пьера</arg>
				<rel f="">прекращала</rel>
				<arg f="tmp" n="m">тотчас же</arg>
				<arg f="" n="1">всякие попытки на насмешку в его присутствии</arg>
			</example>
			<example name="active perfective" src="Russian National Corpus" type="">
				<text>В тот же день ЦБ прекратил деятельность временной администрации Москомприватбанка</text>
				<arg f="tmp" n="m">В тот же день</arg>
				<arg f="" n="0">ЦБ</arg>
				<rel f="">прекратил</rel>
				<arg f="" n="1">деятельность временной администрации Москомприватбанка</arg>
			</example>
		</roleset>
	</predicate>
</frameset>
