<!DOCTYPE frameset SYSTEM "frameset.dtd">
<frameset>
  <predicate lemma="произойти">
  <note>NOTES: Added for LORELEI to support aligning RU and EN texts. Data from Skatje Myers.</note>
	<roleset id="произойти.01" name="happen">
	  <aliases>
		<alias framenet="" pos="j" verbnet="">произошедший</alias>
		<alias framenet="" pos="j" verbnet="">происшедший</alias>
		<alias framenet="" pos="v" verbnet="">происходить</alias>
		<alias framenet="" pos="j" verbnet="">происходящий</alias>
		<alias framenet="" pos="j" verbnet="">происходивший</alias>
	  </aliases>
	  <note>Corresponds to FrameBank sense 2</note>
	  <note>произойти.01 NOTES: Based on happen.01.</note>
	  <roles>
		<role descr="event" f="PPT" n="1"/>
		<role descr="benefactive" f="GOL" n="2"/>
	  </roles>
	  <example name="happen, occur" src="" type="">
		<text>Произошла авария</text>
		<rel f="">Произошла</rel>
		<arg f="" n="1">авария</arg>
	  </example>
	  <example name="predicate adjective, occur" src="Russian National Corpus" type="">
		<text>16октября ФА объявила, что будет расследовать инцидент, происшедший между Эвра иСуаресом.</text>
		<arg f="" n="1">инцидент</arg>
		<rel f="">происшедший</rel>
		<arg f="" n="2">между Эвра иСуаресом</arg>
	  </example>
	</roleset>

	<roleset id="произойти.02" name="originate">
	  <aliases>
		<alias framenet="" pos="j" verbnet="">произошедший</alias>
	  </aliases>
	  <note>Corresponds to FrameBank senses 1</note>
	  <note>произойти.02 NOTES: Based on descend.01.</note>
	  <roles>
	   <role descr="entity descended" f="PPT" n="1"/>
		<role descr="source, ancestor" f="DIR" n="2"/>
	  </roles>
	  <example name="descend, originate" src="" type="">
		<text>Мужчины произошли от других обезьян .</text>
		<arg f="" n="1">Мужчины</arg>
		<rel f="">произошли</rel>
		<arg f="" n="2">от других обезьян</arg>
	  </example>
	  <example name="originate, imperfective" src="Л. Н. Толстой, «Богу или Маммоне?», 1896 г. (цитата из Национального корпуса русского языка, см. Список литературы)" type="">
		<text>То же , что веселье , которое происходит от вина , не есть настоящее и не радостное веселье , не нужно и доказывать .</text>
		<arg f="" n="1">которое</arg>
		<rel f="">происходит</rel>
		<arg f="" n="2">от вина</arg>
	  </example>
	  <example name="descend, birthed" src="Russian National Corpus" type="">
		<text>С тех пор, как мне впервые улыбнулся произошедший от меня младенец, я знаю, что любить можно иное и иначе.</text>
		<rel f="">произошедший</rel>
		<arg f="" n="2">от меня</arg>
		<arg f="" n="1">младенец</arg>
	  </example>
	</roleset>
  </predicate>
</frameset>
