<?xml version="1.0" encoding="utf-8" standalone="no"?>
<!DOCTYPE frameset SYSTEM "frameset.dtd">
<frameset>
  <predicate lemma="стоить">
    <note>NOTES: Added for LORELEI to support aligning RU and EN texts. Data from Skatje Myers.</note>
    <roleset id="стоить.01" name="cost">
      <aliases>
        <alias pos="j">стоящий</alias>
        <alias pos="j">стоивший</alias>
        <alias pos="v">стоивши</alias>
        <alias pos="v">стоив</alias>
      </aliases>
      <note>Corresponds to FrameBank senses 1,2</note>
      <note>стоить.01 NOTES: Based on cost.01</note>
      <roles>
        <role descr="commodity" f="PPT" n="1"/>
        <role descr="price" f="vsp" n="2"/>
      </roles>
      <example name="cost" src="">
        <text>Фигово ей ) Щетка стоит примерно 4 тысячи , если она реально лучше обычной , то обязательно возьму . Лучше предотвратить кариес , чем лечить его</text>
        <propbank>
          <arg type="ARG1" start="3" end="3">Щетка</arg>
          <rel relloc="4">стоит</rel>
          <arg type="ARGM-ADV" start="5" end="5">примерно</arg>
          <arg type="ARG2" start="6" end="7">4 тысячи</arg>
        </propbank>
      </example>
    </roleset>
    <roleset id="стоить.02" name="be worth">
      <aliases>
        <alias pos="j">стоящий</alias>
        <alias pos="j">стоивший</alias>
        <alias pos="v">стоивши</alias>
        <alias pos="v">стоив</alias>
      </aliases>
      <note>Corresponds to FrameBank senses 3,4,5</note>
      <note>стоить.02 NOTES: Based on worth.01</note>
      <roles>
        <role descr="worthy thing" f="PAG" n="1"/>
        <role descr="worthy of what" f="PPT" n="2"/>
        <role descr="entity recognizing value" f="GOL" n="3"/>
      </roles>
      <example name="worth it" src="">
        <text>Но разве оно того стоило ?</text>
        <propbank>
          <arg type="ARGM-DIS" start="0" end="0">Но</arg>
          <arg type="ARGM-ADV" start="1" end="1">разве</arg>
          <arg type="ARG1" start="2" end="2">оно</arg>
          <arg type="ARG2" start="3" end="3">того</arg>
          <rel relloc="4">стоило</rel>
        </propbank>
      </example>
      <example name="should, worth doing" src="">
        <text>Погорельцам стоит пикет организовать , причем реальный с лопатами и вилами , для тупорылых ментов можно огонь прихватить и еще дома сжечь местных чиновников , чтоб в следующий раз мозгами думали а не жопой и делать это нужно всем вместе .</text>
        <propbank>
          <arg type="ARG3" start="0" end="0">Погорельцам</arg>
          <rel relloc="1">стоит</rel>
          <arg type="ARG2" start="2" end="3">пикет организовать</arg>
        </propbank>
      </example>
    </roleset>
    <roleset id="стоить.03" name="all it takes, barely begin, just do it">
      <aliases>
	  </aliases>
      <note>Corresponds to FrameBank sense 6</note>
      <note>стоить.03 NOTES: Based on English begin.02</note>
      <note>Often followed by word "только", "лишь", "всего лишь", etc.</note>
      <roles>
        <role descr="Action (barely) begun" f="PPT" n="1"/>
        <role descr="Instrument, starting point" f="MNR" n="2"/>
      </roles>
      <example name="only begin" src="М. А. Булгаков, «Мастер и Маргарита, часть 1», 1929-1940 г. (цитата из Национального корпуса русского языка, см. Список литературы)">
        <text>Ну , а колдовству , как известно , стоит только начаться , а там уж его ничем не остановишь .</text>
        <propbank>
          <rel relloc="8">стоит</rel>
          <arg type="ARGM-ADV" start="9" end="9">только</arg>
          <arg type="ARG1" start="10" end="10">начаться</arg>
        </propbank>
      </example>
      <example name="all it takes" src="Oksana Melnyk">
        <text>Стоить только сказать слово * улица * и моя собачка уже тут как тут .</text>
        <propbank>
          <rel relloc="0">Стоить</rel>
          <arg type="ARGM-ADV" start="?" end="?">только</arg>
          <arg type="ARG1" start="?" end="?">сказать слово *улица*</arg>
        </propbank>
      </example>
    </roleset>
  </predicate>
</frameset>