<?xml version="1.0" encoding="utf-8" standalone="no"?>
<!DOCTYPE frameset SYSTEM "frameset.dtd">
<frameset>
  <predicate lemma="заметить">
    <note>NOTES: Added for LORELEI to support aligning RU and EN texts. Data from Skatje Myers unless otherwise noted.</note>
    <roleset id="заметить.01" name="note, notice, see, observe">
      <aliases>
        <alias pos="v">замечать</alias>
        <alias pos="v">замечаться</alias>
        <alias pos="v">заметиться</alias>
      </aliases>
      <note>заметить.01 NOTES: Roleset based on English verb frame notice.01</note>
      <note>Corresponds to FrameBank senses 1, 2, 3, 6</note>
      <roles>
        <role descr="noticer" f="PAG" n="0"/>
        <role descr="noticed" f="PPT" n="1"/>
      </roles>
      <example name="all args" src="Татьяна Труфанова, «Не/друг», 2016 г. (цитата из Национального корпуса русского языка, см. Список литературы)">
        <text>Славик дёрнулся , как от электроразряда . Заметила ли она ручку ? ! — Поехали , — сказала Катерина . Саврасов нервно сглотнул и тронулся с места .</text>
        <propbank>
          <arg type="ARG0" start="9" end="9">она</arg>
          <rel relloc="7">Заметила</rel>
          <arg type="ARG1" start="10" end="10">ручку</arg>
        </propbank>
      </example>
      <example name="reflexive as passive" src="Russian National Corpus[Александр Ослон. Мир теорий в эпоху «охвата» // «Отечественные записки», 2003]">
        <text>Это замечается не только у детей , которые невольно воспринимают всякое мнение , предложенное им , но также у людей величайшей рассудительности и ума ; и им бывает очень трудно следовать собственному разуму и собственным наклонностям вопреки мнениям их друзей и ежедневных собеседников "</text>
        <propbank>
          <arg type="ARG1" start="0" end="0">Это</arg>
          <rel relloc="1">замечается</rel>
        </propbank>
      </example>
    </roleset>
    <roleset id="заметить.02" name="take note, remember, note, make note of">
      <aliases>
        <alias pos="v">замечать</alias>
      </aliases>
      <note>заметить.02 NOTES: Roleset based on English verb frame memorize.01</note>
      <note>Corresponds to FrameBank senses 5</note>
      <roles>
        <role descr="memorizer" f="PAG" n="0"/>
        <role descr="thing memorized" f="PPT" n="1"/>
      </roles>
      <example name="example" src="Russian National Corpus[Е. Л. Шварц. Сказка о потерянном времени (1940-1950)]">
        <text>Я вчера не заметил дороги обратно к домику ― боялся время потерять .</text>
        <propbank>
          <arg type="ARG0" start="0" end="0">Я</arg>
          <arg type="ARGM-TMP" start="1" end="1">вчера</arg>
          <arg type="ARGM-NEG" start="2" end="2">не</arg>
          <rel relloc="3">заметил</rel>
          <arg type="ARG1" start="4" end="7">дороги обратно к домику</arg>
        </propbank>
      </example>
    </roleset>
    <roleset id="заметить.03" name="remark, make note, say, mention">
      <aliases>
        <alias pos="v">замечать</alias>
      </aliases>
      <note>заметить.03 NOTES: Roleset based on English verb frame note.01</note>
      <note>Corresponds to FrameBank senses 4</note>
      <roles>
        <role descr="noter" f="PAG" n="0"/>
        <role descr="utterance" f="PPT" n="1"/>
        <role descr="hearer" f="GOL" n="2"/>
        <role descr="attribute of arg1" f="GOL" n="3"/>
      </roles>
      <example name="perfective" src="Russian National Corpus[Наталья Дубова. Вокруг ITSM // «Computerworld», 2004]">
        <text>" У нас уже есть примеры , когда при наличии определённой воли у бизнес - подразделений ИТ - департаменты начинают предоставлять и даже продавать именно услуги " , ― заметил он .</text>
        <propbank>
          <arg type="ARG1" start="1" end="25">У нас уже есть примеры , когда при наличии определённой воли у бизнес - подразделений ИТ - департаменты начинают предоставлять и даже продавать именно услуги</arg>
          <rel relloc="29">заметил</rel>
          <arg type="ARG0" start="30" end="30">он</arg>
        </propbank>
      </example>
    </roleset>
  </predicate>
  <predicate lemma="ни_в_чем_не_замечен">
    <roleset id="ни_в_чем_не_замечен.04" name="not suspected">
      <note>PASSIVE ONLY. NEGATIVE ONLY.</note>
      <aliases>
        <mwe id="ни_в_чем_не_замечен">
          <token slot="A" arg="" pos="" head="C" dep="">ни</token>
          <token slot="B" arg="" pos="" head="C" dep="">в</token>
          <token slot="C" arg="" pos="" head="A" dep="">чем</token>
          <token slot="D" arg="" pos="" head="A" dep="">не</token>
          <token slot="E" arg="" pos="" head="" dep="">замечен</token>
        </mwe>
      </aliases>
      <note>Based on English frame suspect.01</note>
      <roles>
        <role descr="suspecter" f="PAG" n="0"/>
        <role descr="suspicion: what arg0 thinks" f="PPT" n="1"/>
        <role descr="suspect; entity inspring suspicion in arg0" f="PRD" n="2"/>
      </roles>
      <example name="example" src="Russian National Corpus [М. А. Булгаков. Мастер и Маргарита, часть 2 (1929-1940)]">
        <text>Она дала самые лестные рекомендации коту , объяснила , что знает его пять лет с тех пор , как он был котёнком , ручается за него , как за самоё себя , доказала , что он ни в чём плохом не замечен и никогда не ездил в Москву .</text>
        <propbank>
          <arg type="ARG0" start="?" end="?">он</arg>
          <rel relloc="?">ни</rel>
          <rel relloc="?">в</rel>
          <rel relloc="?">чём</rel>
          <arg type="ARG1" start="39" end="39">плохом</arg>
          <rel relloc="?">не</rel>
          <rel relloc="?">замечен</rel>
        </propbank>
      </example>
    </roleset>
  </predicate>
</frameset>