<!DOCTYPE frameset SYSTEM "frameset.dtd">
<frameset>
  <predicate lemma="переполнить">
    <note>NOTES: Added for LORELEI to support aligning RU and EN texts. Data from Skatje Myers.</note>
    <roleset id="переполнить.01" name="overfill">
      <aliases>
		<alias framenet="" pos="j" verbnet="">переполнен</alias>
		<alias framenet="" pos="j" verbnet="">переполненный</alias>
		<alias framenet="" pos="j" verbnet="">переполнивший</alias>
		<alias framenet="" pos="v" verbnet="">переполнять</alias>
		<alias framenet="" pos="j" verbnet="">переполняющий</alias>
		<alias framenet="" pos="j" verbnet="">переполнявший</alias>
		<alias framenet="" pos="j" verbnet="">переполняемый</alias>
		<alias framenet="" pos="v" verbnet="">переполниться</alias>
		<alias framenet="" pos="j" verbnet="">переполнившийся</alias>
		<alias framenet="" pos="v" verbnet="">переполняться</alias>
		<alias framenet="" pos="j" verbnet="">переполняющийся</alias>
		<alias framenet="" pos="j" verbnet="">переполнявшийся</alias>
      </aliases>
      <note>переполнить.01 NOTES: Roleset based on English verb frame fill.01</note>
      <roles>
        <role descr="agent, causer" f="PAG" n="0">
        </role>
        <role descr="container which has been filled beyond capacity" f="GOL" n="1">
        </role>
        <role descr="substance" f="PPT" n="2">
        </role>
      </roles>
      <example name="arg 0 and 1, inanimate causer" src="" type="">
        <text>Стекающая с речных водосборов вода переполнила русла основных рек .</text>
        <arg f="" n="0">Стекающая с речных водосборов вода</arg>
        <rel f="">переполнила</rel> 
        <arg f="" n="1">русла основных рек</arg>
      </example>
      <example name="passive participle, arg 1 and 2" src="" type="">
        <text>А тут случайно данный сайт , который как обычно переполнен скепсисом и негативом .</text>
		<arg f="" n="1">*PRO*</arg>
		<arg f="adv" n="m">как обычно</arg>
        <rel f="">переполнен</rel>
        <arg f="" n="2">скепсисом и негативом</arg>
      </example>
      <example name="active participle, arg 1 only" src="" type="">
        <text>Эвакуированные после урагана Катрина , переполнившие регион , усложняли эвакуацию во время урагана Рита , так же как и массовое бегство из Хьюстона окрестностей .</text>
        <arg f="" n="0">*PRO*</arg>
        <rel f="">переполнившие</rel>
        <arg f="" n="1">регион</arg>
      </example>
      <example name="adjective form" src="" type="">
        <text>Уезжающие на войну солдаты и офицеры в переполненных вагонах , как всходящие на крест , и равные , и вперемешку на ступеньках забитых вагонов ...</text>
        <rel f="">переполненных</rel>
        <arg f="com" n="m">вагонах</arg>
      </example>
      <example name="passive participle, args 1 and 2" src="web" type="">
        <text>Больницы переполнены ранеными .</text>
		<arg f="" n="1">Больницы</arg>
        <rel f="">переполнены</rel>
        <arg f="" n="2">ранеными</arg>
      </example>
      <example name="passive participle with auxiliary, arg 1 only" src="" type="">
        <text>Если в 2002 году оно было ПЕРЕПОЛНЕНО , то в 2011 чуть не ВЫСОХЛО полностью , что в т.ч. нарушив водоснабжение Новороссийска .</text>
        <arg f="adv" n="m">Если</arg>
		<arg f="tmp" n="m">в 2002 году</arg>
		<arg f="" n="1">оно</arg>
        <rel f="">ПЕРЕПОЛНЕНО</rel>
      </example>
	  <example name="reflexive perfective" src="https://dic.academic.ru/dic.nsf/ogegova/156546" type="">
        <text>Сердце переполнилось радостью</text>
		<arg f="" n="1">Сердце</arg>
        <rel f="">переполнилось</rel>
		<arg f="" n="2">радостью</arg>
      </example>
    </roleset>
  </predicate>
</frameset>
