<!DOCTYPE frameset SYSTEM "frameset.dtd">
<frameset>
    <predicate lemma="разорять">
        <roleset id="разорять.01" name="Ruin, ravage, be broke">
            <aliases>
                <alias pos="v">разорять</alias>
                <alias pos="v">разорить</alias>
                <alias pos="j">разоряющий</alias>
                <alias pos="j">разорённый</alias>
            </aliases>
            <note>Corresponds to FrameBank senses [insert appropriate thing here]</note>
            <note>NOTES: based on English broke.27</note>
            <roles>
                <role descr="Ruiner" f="PAG" n="0"/>
                <role descr="Person ruined or broke" f="PPT" n="1"/>
            </roles>
            <example name="Arg1 only" src="_">
                <text>Я разорён !</text>
                <propbank>
                    <arg type="ARG1" start="0" end="0">Я</arg>
                    <rel relloc="1">разорён</rel>
                </propbank>
            </example>
            <example name="Arg0 and Arg1" src="RNC, А. С. Суворин. Дневник (1893)">
                <text>Пьяный разоряет свою семью и т. д.</text>
                <propbank>
                    <arg type="ARG0" start="0" end="0">Пьяный</arg>
                    <rel relloc="1">разоряет</rel>
                    <arg type="ARG1" start="2" end="3">свою семью</arg>
                </propbank>
            </example>
        </roleset>
    </predicate>
</frameset>